RealNote,https://www.crunchbase.com/organization/realnote,Active,,"Augmented Reality, Social Network","Bonn, Nordrhein-Westfalen, Germany",Social Augmented Reality Network,"1,934,707","European Union (EU), Europe, Middle East, and Africa (EMEA)",,,2017-01-01,year,,,,,For Profit,http://www.real-note.com,https://twitter.com/RealNote_GmbH,https://www.facebook.com/RealNoteGmbH/,,"RealNote ebables users to create, publish and interact with 3D content in their real world surrounding. Like digital grafitti users can post messages, images or modells permanently to real world objects. Published content will be visible to everyone visiting the same place. RealNote is based on a intelligent object recognition analysing the users surrounding and allowing persistent augmentations. With a detailed understanding of its surrounding RealNote is able to locate each user in the real world and overlay the AR world accordingly.","Hardware, Internet Services, Software",,1-10,,,,,,,,,,,,,,,,,,,,,,,,,,,,,,,,,,,Private,,,,,,,,,,,
Super7000,https://www.crunchbase.com/organization/super7000,Active,,"Facilities Support Services, Facility Management, Rental","Düsseldorf, Nordrhein-Westfalen, Germany","Super7000 is a coworking space company that offers rental space for events, meeting, and business address.","1,938,330","European Union (EU), Europe, Middle East, and Africa (EMEA)",40235,,2017-01-01,year,,,,,For Profit,https://super7000.de,https://twitter.com/spr7000,https://www.facebook.com/spr7000,https://www.linkedin.com/company/super7000-gmbh,,"Administrative Services, Commerce and Shopping, Real Estate",,11-50,,,,,,,,,,,,,,,,,,,,,,,,,,,,,,,,,,,Private,,,,,,,,,,,
GREENKARMA,https://www.crunchbase.com/organization/greenkarma,Active,,"Food and Beverage, Food Delivery, Restaurants","Düsseldorf, Nordrhein-Westfalen, Germany",GREENKARMA is a restaurant that specializes in healthy foods and salads with dine-in and delivery services.,"1,938,934","European Union (EU), Europe, Middle East, and Africa (EMEA)",40217,$1M to $10M,2017-01-01,year,,,,,For Profit,https://www.greenkarma.de,,https://www.facebook.com/GREENKARMA.de/?locale2=de_DE,https://www.linkedin.com/company/greenkarma-salads,,"Food and Beverage, Transportation",,11-50,,,,,,,,,,,,,,,,,,,,,,,,,,,,,,,,,,,Private,,,,,,,,,,,
"Little Miss Fancy, Inc.",https://www.crunchbase.com/organization/little-miss-fancy-inc,Active,,"Android, E-Commerce, Fashion, Logistics","Cologne, Nordrhein-Westfalen, Germany","Little Miss Fancy is a fashion, technology, e-commerce, logistics business that rents outfits for little girls via website and mobile app.","1,939,646","European Union (EU), Europe, Middle East, and Africa (EMEA)",,$1M to $10M,2017-01-01,year,,,,,For Profit,http://www.LittleMissFancy.com,,,,,"Clothing and Apparel, Commerce and Shopping, Design, Mobile, Platforms, Software, Transportation",,1-10,,,,,,,,,,,,,,,,,,,,,,,,,,,,,,,,,,,Private,,,,,,,,,,,
Mon Agence,https://www.crunchbase.com/organization/mon-agence,Active,,"Advertising, Management Consulting, Web Development","Liège, Liege, Belgium","Mon Agence offers management consulting services including social SEO and SEA optimization, media management, and website development.","1,952,613","European Union (EU), Europe, Middle East, and Africa (EMEA)",,,2017-01-01,year,,,,,For Profit,https://monagence.be,https://twitter.com/monagence360,https://www.facebook.com/MonAgenceLiege,https://www.linkedin.com/company/monagence,,"Advertising, Professional Services, Sales and Marketing, Software",,1-10,,,,,,,,,,,,,,,,,,,,,,,,,,,,,,,,,,,Private,,,,,,,,,,,
The Bread Theater,https://www.crunchbase.com/organization/the-bread-theater,Active,,"Bakery, Food and Beverage, Food Processing","Flémalle-grande, Liege, Belgium",The Bread Theater is a bakery that produces bakery and pastry products.,"1,955,878","European Union (EU), Europe, Middle East, and Africa (EMEA)",4400,,2017-01-01,year,,,,,For Profit,http://letheatredupain.be,https://twitter.com/LeTheatreDuPain,https://www.facebook.com/latelierdupaindolembreux,https://www.linkedin.com/company/destin%C3%A9-andr%C3%A9-sprl-le-th%C3%A9%C3%A2tre-du-pain/,,Food and Beverage,,11-50,,,,,,,,,,,,,,,,,,,,,,,,,,,,,,,,,,,Private,,,,,,,,,,,
Get Bike Service,https://www.crunchbase.com/organization/get-bike-service,Active,,"Consulting, Customer Service, Fleet Management","Maastricht, Limburg, The Netherlands","Get Bike Service provides smart fleet management, maintenance, and repair services for LEV fleets.","1,959,332","European Union (EU), Europe, Middle East, and Africa (EMEA)",6211,$1M to $10M,2017-01-01,year,,,,,For Profit,https://getbikeservice.com,,https://www.facebook.com/getbikeservice,https://www.linkedin.com/company/getbikeservice,"GO BikeService BV offers smart fleet management, maintenance, and repair services for small and large Light Electric Vehicle (LEV) fleets. The company specializes in providing service to all types of bicycles. They also offer a mobile bike workshop, which is an optimal solution for on-the-go bike repairs and maintenance. The company is a premium partner for bike services and has a team of professionals who are dedicated to providing efficient services.","Other, Professional Services, Transportation",,11-50,,,,,,,,,,,,,,,,,,,,,,,,,,,,,,,,,,,Private,,,,,,,,,,,
Schmiede One,https://www.crunchbase.com/organization/schmiede-one,Active,,"Information Technology, Manufacturing, Project Management, Robotics, Software","Düsseldorf, Nordrhein-Westfalen, Germany","Schmiede One specializes in robotics, software, development, hardware, design, and project management.","1,959,918","European Union (EU), Europe, Middle East, and Africa (EMEA)",40479,,2017-01-01,year,,,,,For Profit,https://schmiede.one,,https://www.facebook.com/p/schmiedeone-100064153836581,https://www.linkedin.com/company/schmiedeone,,"Administrative Services, Hardware, Information Technology, Manufacturing, Other, Science and Engineering, Software",,11-50,,,,,,,,,,,,,,,,,,,,,,,,,,,,,,,,,,,Private,,,,,,,,,,,
AB-Informatik,https://www.crunchbase.com/organization/ab-informatik,Active,,"Cloud Infrastructure, Consulting, Document Management, IT Management","Bad Honnef Am Rhein, Nordrhein-Westfalen, Germany","AB-Informatik offers cloud computing, network technology, and IT support.","1,961,528","European Union (EU), Europe, Middle East, and Africa (EMEA)",53604,,2017-01-01,year,,,,,For Profit,https://www.ab-informatik.net,,,https://www.linkedin.com/company/ab-informatik-gmbh/,"AB-Informatik provides IT solutions and comprehensive IT consulting. The company provides tailor-made support, services, and user-specific solutions for computing systems, and is available as a competent contact for all questions about technology. They offers comprehensive expertise in cloud technologies, network technology, IT support, and IT security.","Hardware, Information Technology, Internet Services, Professional Services, Software",,1-10,,,,,,,,,,,,,,,,,,,,,,,,,,,,,,,,,,,Private,,,,,,,,,,,
Bettwäsche Finder,https://www.crunchbase.com/organization/bettwäsche-finder,Active,,"Consumer Goods, E-Commerce, Sales","Köln, Nordrhein-Westfalen, Germany",Bettwäsche Finder is a german based online store that offers sheets and duvet covers for beddings.,"1,962,364","European Union (EU), Europe, Middle East, and Africa (EMEA)",51145,$1M to $10M,2017-01-01,year,,,,,For Profit,https://www.bettwaesche-finder.de,https://twitter.com/bettwaesche_fi,,https://www.linkedin.com/company/bettwaesche-finder-de,,"Commerce and Shopping, Consumer Goods, Sales and Marketing",,1-10,,,,,,,,,,,,,,,,,,,,,,,,,,,,,,,,,,,Private,,,,,,,,,,,
RUHR REAL,https://www.crunchbase.com/organization/ruhr-real,Active,,"Commercial Real Estate, Real Estate, Service Industry","Essen, Nordrhein-Westfalen, Germany",RUHR REAL is a real estate company that offers consulting services for businesses.,"1,967,933","European Union (EU), Europe, Middle East, and Africa (EMEA)",,,2017-01-01,year,,,,,For Profit,https://ruhr-real.de,,,https://www.linkedin.com/company/ruhr-real-gmbh,,"Other, Real Estate",,11-50,,,,,,,,,,,,,,,,,,,,,,,,,,,,,,,,,,,Private,,,,,,,,,,,
F1-Generation,https://www.crunchbase.com/organization/f1-generation,Active,,"Fashion, Lingerie, Supply Chain Management, Wholesale","Cologne, Nordrhein-Westfalen, Germany","F1-Generation distributes and markets fashion brand products ranging from loungewear, legwear, swimwear, hosiery, and fashion accessories.","1,979,972","European Union (EU), Europe, Middle East, and Africa (EMEA)",50672,$1M to $10M,2017-01-01,year,,,,,For Profit,https://www.f1-generation.com/,,,https://www.linkedin.com/company/f1-generation-gmbh,,"Clothing and Apparel, Commerce and Shopping, Consumer Goods, Design, Transportation",,,,,,,,,,,,,,,,,,,,,,,,,,,,,,,,,,,,,Private,,,,,,,,,,,
Ilini,https://www.crunchbase.com/organization/ilini,Active,,"Internet, Language Learning, Media and Entertainment, Video","Rukkelingen-loon, Limburg, Belgium","Ilini helps people learn foreign languages through real-life media, select news and entertainment videos with interactive subtitles.","2,002,114","European Union (EU), Europe, Middle East, and Africa (EMEA)",69006,Less than $1M,2017-01-01,year,,,,,For Profit,https://ilini.com,https://www.twitter.com/https://twitter.com/intent/follow?&screen_name=iliniFrench,https://www.facebook.com/iliniFrench,https://www.linkedin.com/company/ilini/,,"Education, Internet Services, Media and Entertainment, Video",,1-10,,,,,,,,,,,,,,,,,,,,,,,,,,,,,,,,,,,Private,,,,,,,,,,,
Operando Partners,https://www.crunchbase.com/organization/operando-partners,Active,,"Finance, Project Management, Venture Capital","Cologne, Nordrhein-Westfalen, Germany","Operando Partners is a financial company that provides venture capital, private equity, executive coaching, and project management services.","2,010,369","European Union (EU), Europe, Middle East, and Africa (EMEA)",Cologne,,2017-01-01,year,,,,,For Profit,https://operando.de/,,https://www.facebook.com/operandopartners,https://www.linkedin.com/company/operando-partners/,,"Administrative Services, Financial Services, Lending and Investments, Other",,1-10,,,,,,,,,,,,,,,,,,,,,,,,,,,,,,,,,,,Private,,,,,,,,,,,
Unimicron Germany,https://www.crunchbase.com/organization/unimicron-germany,Active,,"Electronics, Manufacturing","Geldern, Nordrhein-Westfalen, Germany","Unimicron Germany manufactures printed circuit boards for the automotive, renewable energies and industrial segments.","2,013,946","European Union (EU), Europe, Middle East, and Africa (EMEA)",47608,$50M to $100M,2017-01-01,year,,,,,For Profit,https://www.unimicron-germany.de,,https://www.facebook.com/unimicrongermanyofficial/,https://www.linkedin.com/company/unimicron-germany/,,"Consumer Electronics, Hardware, Manufacturing",,251-500,,,,,,,,,,,,,,,,,,,,,,,,,,,,,,,,,,,Private,,,,,,,,,,,
xValue,https://www.crunchbase.com/organization/xvalue,Active,,"Management Consulting, Product Design","Ratingen, Nordrhein-Westfalen, Germany","xValue is a consulting firm specialising in business growth, software development, data science, and process design.","2,032,852","European Union (EU), Europe, Middle East, and Africa (EMEA)",40882,$1M to $10M,2017-01-01,year,,,,,For Profit,https://www.xvalue.de/,,,https://www.linkedin.com/company/xvalue-gmbh,,"Design, Professional Services",,11-50,,,,,,,,,,,,,,,,,,,,,,,,,,,,,,,,,,,Private,,,,,,,,,,,
FanQ,https://www.crunchbase.com/organization/fanq,Active,,Mobile Apps,"Cologne, Nordrhein-Westfalen, Germany",FanQ offer you the opportunity to discuss various topics in football app and keep you up to date with notifications.,"2,035,921","European Union (EU), Europe, Middle East, and Africa (EMEA)",50670,,2017-01-01,year,,,,,For Profit,https://fanq-app.com/,,,https://www.linkedin.com/company/fanq,FanQ offer you the opportunity to discuss various topics in football app and keep you up to date with notifications.,"Apps, Mobile, Software",,,,,,,,,,,,,,,,,,,,,,,,,,,,,,,,,,,,,Private,,,,,,,,,,,
Vilusio,https://www.crunchbase.com/organization/vilusio,Active,,"Gaming, Information Technology, Software, Virtual Reality","Cologne, Nordrhein-Westfalen, Germany","Vilusio develops virtual and augmented reality software solutions for the architecture, games and POS industries.","2,050,505","European Union (EU), Europe, Middle East, and Africa (EMEA)",51105,,2017-01-01,year,,,,,For Profit,http://www.vilusio.com/,https://twitter.com/vilusioapps,https://www.facebook.com/pg/vilusio,https://www.linkedin.com/company/vilusio-gmbh,"Vilusio develops virtual and augmented reality software solutions for the architecture, games and POS industries. Additionally, Vilusio develops 3D configuration tools as well as 3D photo-realistic visualizations for print media, PC, mobile devices and browsers - the latter without the need for any plug-ins.","Gaming, Hardware, Information Technology, Software",,,,,,,,,,,,,,,,,,,,,,,,,,,,,,,,,,,,,Private,,,,,,,,,,,1
I Love To Quilt,https://www.crunchbase.com/organization/i-love-to-quilt,Active,,"Manufacturing, Shopping, Textiles","Echt, Limburg, The Netherlands","I Love To Quilt engages in the design, manufacture, and sales of quilting rulers and patterns.","2,053,013","European Union (EU), Europe, Middle East, and Africa (EMEA)",,Less than $1M,2017-01-01,day,,,,,For Profit,https://www.ilovetoquilt.nl/,,https://www.facebook.com/ilovetoquilt.nl/,,,"Commerce and Shopping, Manufacturing",,1-10,,,,,,,,,,,,,,,,,,,,,,,,,,,,,,,,,,,Private,,,,,,,,,,,
Foursides,https://www.crunchbase.com/organization/foursides,Active,,"Video, Video Streaming, Web Development","Liège, Liege, Belgium","Foursides is a video production company that creates corporate videos, commercial documents, and visual identities.","2,068,166","European Union (EU), Europe, Middle East, and Africa (EMEA)",4000,$1M to $10M,2017-01-01,year,,,,,For Profit,https://foursides.be,,https://www.facebook.com/AgenceFoursides,https://www.linkedin.com/company/foursides,,"Content and Publishing, Media and Entertainment, Software, Video",,1-10,,,,,,,,,,,,,,,,,,,,,,,,,,,,,,,,,,,Private,,,,,,,,,,,
Appsoluts,https://www.crunchbase.com/organization/appsoluts,Active,,"Android, Information Technology, iOS, Mobile Apps, Software, Web Apps, Web Development","Düsseldorf, Nordrhein-Westfalen, Germany","Appsoluts is a full service provider for individual software development & app development in iOS, Android, web frontend and backend","2,085,601","European Union (EU), Europe, Middle East, and Africa (EMEA)",40231,,2017-01-01,day,,,,,For Profit,https://appsoluts.de/,,https://www.facebook.com/Appsoluts,https://www.linkedin.com/company/appsoluts/,,"Apps, Information Technology, Mobile, Platforms, Software",,1-10,,,,,,,,,,,,,,,,,,,,,,,,,,,,,,,,,,,Private,,,,,,,,,,,
Agrizo,https://www.crunchbase.com/organization/agrizo,Active,,"Agriculture, Farming, Livestock","America, Limburg, The Netherlands","Agrizo is a supplier of fertilizers, crop protection products, and seeds for agriculture and horticulture.","2,086,870","European Union (EU), Europe, Middle East, and Africa (EMEA)",,$10M to $50M,2017-01-01,year,,,,,For Profit,https://www.agrizo.nl,,https://www.facebook.com/profile.php?id=100057335744735,https://www.linkedin.com/company/agrizo-nederland-b.v.,,Agriculture and Farming,,1-10,,,,,,,,,,,,,,,,,,,,,,,,,,,,,,,,,,,Private,,,,,,,,,,,
Genzai,https://www.crunchbase.com/organization/genzai,Active,,"Analytics, Artificial Intelligence (AI), Big Data, Information Technology","Venlo, Limburg, The Netherlands",Genzai delivers and helps businesses by using concepts from artificial intelligence and big data analytics.,"2,087,856","European Union (EU), Europe, Middle East, and Africa (EMEA)",5916PJ,,2017-01-01,day,,,,,For Profit,http://www.genzai.nl/,,,https://www.linkedin.com/company/genzai-nl/,,"Artificial Intelligence (AI), Data and Analytics, Information Technology, Science and Engineering, Software",,1-10,,,,,,,,,,,,,,,,,,,,,,,,,,,,,,,,,,,Private,,,,,,,,,,,
Balancr,https://www.crunchbase.com/organization/balancr,Active,,"Computer, Financial Services, Software","Cologne, Nordrhein-Westfalen, Germany",Balancr is the scalable and secure wallet-as-a-service that can be integrated fast and easily.,"2,089,259","European Union (EU), Europe, Middle East, and Africa (EMEA)",50667,Less than $1M,2017-01-01,year,,,,,For Profit,https://balancr.io,,https://www.facebook.com/pg/balancr.io,https://www.linkedin.com/company/18038166/,Balancr is the scalable and secure wallet-as-a-service that can be integrated fast and easily. A perfect match for fintech startups that require efficient balance management.,"Consumer Electronics, Financial Services, Hardware, Software",,1-10,,,,,,,,,,,,,,,,,,,,,,,,,,,,,,,,,,,Private,,,,,,,,,,,1
ProAct Software,https://www.crunchbase.com/organization/proact-software,Active,,"Fleet Management, Software, Web Development","Venlo, Limburg, The Netherlands",ProAct Software provides an integrated software solution for managing all maintenance and fleet management operations.,"2,101,339","European Union (EU), Europe, Middle East, and Africa (EMEA)",,$1M to $10M,2017-01-01,year,,,,,For Profit,https://www.proactsoftware.eu,,https://www.facebook.com/proactsoftware,https://www.linkedin.com/company/proact-software-bv,,"Software, Transportation",1,1-10,Cosmin Lixandru,,,,,,,,,,,,,,,,,,,,,,,,,,,,,,,,,,Private,,,,,,,,,,,
Krios Automation,https://www.crunchbase.com/organization/krios-automation,Active,,"Industrial Automation, Mechanical Engineering, Transportation","Genk, Limburg, Belgium",Krios Automation specializes in floor transport installation and overhead transport installation for robot stations.,"2,109,064","European Union (EU), Europe, Middle East, and Africa (EMEA)",3600,$1M to $10M,2017-01-01,year,,,,,For Profit,https://krios-automation.be,,,https://www.linkedin.com/company/krios-automation,,"Manufacturing, Science and Engineering, Transportation",,1-10,,,,,,,,,,,,,,,,,,,,,,,,,,,,,,,,,,,Private,,,,,,,,,,,
NCS Netcare Consulting and Engineering Services,https://www.crunchbase.com/organization/ncs-netcare-consulting-and-engineering-services,Active,,"Communications Infrastructure, Professional Networking, Telecommunications","Düsseldorf, Nordrhein-Westfalen, Germany",NCS Netcare Consulting and Engineering Services operates as a telecommunications infrastructure provider.,"2,111,739","European Union (EU), Europe, Middle East, and Africa (EMEA)",40547,Less than $1M,2017-01-01,year,,,,,For Profit,https://www.netcare.services,,,https://www.linkedin.com/company/netcare-services/,,"Community and Lifestyle, Hardware, Professional Services",,101-250,,,,,,,,,,,,,,,,,,,,,,,,,,,,,,,,,,,Private,,,,,,,,,,,
scrm-centre,https://www.crunchbase.com/organization/scrm-centre,Active,,"Analytics, Consulting, Risk Management, Supply Chain Management, Training","Bonn, Nordrhein-Westfalen, Germany","scrm-centre is a supply chain risk management firm that offers data cleansing, data analytics, consulting, and training services.","2,112,955","European Union (EU), Europe, Middle East, and Africa (EMEA)",53119,,2017-01-01,year,,,,,For Profit,https://scrmcentre.com,,,https://www.linkedin.com/company/scrm-centre,,"Data and Analytics, Education, Professional Services, Transportation",2,1-10,"Leonidas Fotiou, Michalis Nikolouzos",,,,,,,,,,,,,,,,,,,,,,,,,,,,,,,,,,Private,,,,,,,,,,,
FURTHRresearch,https://www.crunchbase.com/organization/furthrresearch,Active,,"Market Research, Software","Aachen, Nordrhein-Westfalen, Germany",FURTHRresearch is a software development company for research and documentation.,"2,123,110","European Union (EU), Europe, Middle East, and Africa (EMEA)",52066,Less than $1M,2017-01-01,year,,,,,For Profit,https://www.furthr-research.com,,https://www.facebook.com/FURTHRresearch,https://www.linkedin.com/company/furthrresearch/,,"Data and Analytics, Design, Software",,1-10,,,,,,,,,,,,,,,,,,,,,,,,,,,,,,,,,,,Private,,,,,,,,,,,
Levity Parlour,https://www.crunchbase.com/organization/levity-parlour,Active,,"Beauty, E-Commerce, Health Care, Retail","Düsseldorf, Nordrhein-Westfalen, Germany",Levity Parlour is a webshop that provides hair and skin care products.,"2,142,131","European Union (EU), Europe, Middle East, and Africa (EMEA)",,,2017-01-01,day,,,,,For Profit,https://levityparlour.com/,,https://www.facebook.com/levityparloursoaps/,https://www.linkedin.com/company/levity-parlour,,"Commerce and Shopping, Consumer Goods, Health Care",1,1-10,Nadja Ella Hutton-Mills,,,,,,,,,,,,,,,,,,,,,,,,,,,,,,,,,,Private,,,,,,,,,,,
International Sustainable Chemistry Collaborative Centre,https://www.crunchbase.com/organization/international-sustainable-chemistry-collaborative-centre,Active,,"Chemical, Sustainability, Vocational Education","Bonn, Nordrhein-Westfalen, Germany",International Sustainable Chemistry Collaborative Centre promotes and develops sustainable chemistry solutions for sustainable alternatives.,"2,148,915","European Union (EU), Europe, Middle East, and Africa (EMEA)",53113,,2017-01-01,year,,,,,For Profit,https://www.isc3.org,https://twitter.com/isc3centre,https://www.facebook.com/isc3centre/,https://www.linkedin.com/company/international-sustainable-chemistry-collaborative-centre-isc3/,,"Education, Science and Engineering, Sustainability",,11-50,,,,,,,,,,,,,,,,,,,,,,,,,,,,,,,,,,,Private,,,,,,,,,,,
Connectivity,https://www.crunchbase.com/organization/connectivity-177c,Active,,"Analytics, Enterprise Resource Planning (ERP), Fleet Management, GPS","Louveigné, Liege, Belgium","Connectivity specializes in asset tracking, buildings, equipment monitoring, and enterprise resource planning.","2,151,695","European Union (EU), Europe, Middle East, and Africa (EMEA)",4141,$1M to $10M,2017-01-01,year,,,,,For Profit,https://www.connectic.io,,https://www.facebook.com/connecticbe,https://www.linkedin.com/company/connectic-io,,"Data and Analytics, Hardware, Navigation and Mapping, Software, Transportation",,11-50,,,,,,,,,,,,,,,,,,,,,,,,,,,,,,,,,,,Private,,,,,,,,,,,
Engenius,https://www.crunchbase.com/organization/engenius-9f6c,Active,,"Civil Engineering, Construction, Project Management","Halen, Limburg, Belgium",Engenius is a project management company for the construction and infrastructure sectors.,"2,154,980","European Union (EU), Europe, Middle East, and Africa (EMEA)",3545,,2017-01-01,year,,,,,For Profit,https://engenius.eu,,https://www.facebook.com/engeniusnetwork,https://www.linkedin.com/company/engenius-bvba,,"Administrative Services, Other, Real Estate, Science and Engineering",,11-50,,,,,,,,,,,,,,,,,,,,,,,,,,,,,,,,,,,Private,,,,,,,,,,,
digitalsprung,https://www.crunchbase.com/organization/digitalsprung,Active,,"Digital Marketing, Email Marketing, SEO, Social Media Marketing","Hückelhoven, Nordrhein-Westfalen, Germany",Digitalsprung is a digital agency that helps online shops increase sales.,"2,157,333","European Union (EU), Europe, Middle East, and Africa (EMEA)",41836,,2017-01-01,year,,,,,For Profit,https://digitalsprung.de,,https://www.facebook.com/digitalsprung,https://www.linkedin.com/company/digitalsprung,"digitalsprung offers services for the online shop, such as conception and layout, SEO, interface, and development. They provide services for clients' Shopify projects like advisory, design, development, SEO, SEA, social media marketing, email marketing, online marketing, usability audit, and web analysis.","Internet Services, Sales and Marketing",2,1-10,"Christian Schmelzle, Werner Strauch",,,,,,,,,,,,,,,,,,,,,,,,,,,,,,,,,,Private,,,,,,,,,,,
cowork,https://www.crunchbase.com/organization/cowork-4a98,Active,,"Advice, Coworking, Real Estate","Aachen, Nordrhein-Westfalen, Germany","Cowork AG develops and operates coworking spaces, offering location scouting and real estate development services.","2,171,782","European Union (EU), Europe, Middle East, and Africa (EMEA)",52066,$1M to $10M,2017-01-01,year,,,,,For Profit,https://cowork.de,https://twitter.com/cowork_ag,https://www.facebook.com/coworkag,https://www.linkedin.com/company/cowork-ag/,"Cowork AG specializes in the development and operation of coworking spaces. The company offers comprehensive support in location scouting and real estate development for coworking environments. With a focus on creating collaborative and flexible workspaces, Cowork AG aims to cater to the evolving needs of modern professionals and businesses seeking adaptable office solutions. The services are designed to facilitate networking, innovation, and productivity among its community members. Cowork AG operates with a team of 13 employees, committed to providing spaces that foster collaboration and creativity.","Media and Entertainment, Real Estate",1,11-50,Tobias Kollewe,,,,,,,,,,,,,,,,,,,,,,,,,,,,,,,,,,Private,,,,,,,,,,,
Cape6,https://www.crunchbase.com/organization/cape6,Active,,"Advertising, Brand Marketing, Content Marketing, Marketing","Cologne, Nordrhein-Westfalen, Germany","Cape6 is an advertising agency that offers social media strategy, content, and brand marketing services.","2,182,050","European Union (EU), Europe, Middle East, and Africa (EMEA)",50674,$1M to $10M,2017-01-01,year,,,,,For Profit,https://www.cape6.de,,https://www.facebook.com/capesix,https://www.linkedin.com/company/cape6,,"Advertising, Sales and Marketing",,11-50,,,,,,,,,,,,,,,,,,,,,,,,,,,,,,,,,,,Private,,,,,,,,,,,
Hamulight,https://www.crunchbase.com/organization/hamulight,Active,,"Lighting, Wholesale","Panningen, Limburg, The Netherlands",Hamulight offers LED light and its accessories & services of premium quality.,"2,211,112","European Union (EU), Europe, Middle East, and Africa (EMEA)",,$1M to $10M,2017-01-01,day,,,,,For Profit,http://www.hamulight.com,,,https://www.linkedin.com/company/hamulight,,"Commerce and Shopping, Hardware",,1-10,,,,,,,,,,,,,,,,,,,,,,,,,,,,,,,,,,,Private,,,,,,,,,,,
