Bikablo,https://www.crunchbase.com/organization/bikablo,Active,,"E-Learning, Graphic Design, Language Learning, Product Design, Training","Cologne, Nordrhein-Westfalen, Germany","Bikablo offers services, training, and products for visual storytelling, graphic recording, visual facilitation, and visual consulting.","990,624","European Union (EU), Europe, Middle East, and Africa (EMEA)",51105,,2017-01-01,year,,,,,For Profit,https://bikablo.com/ueber-uns-2/,https://twitter.com/bikablo,https://www.facebook.com/bikablo/,https://www.linkedin.com/company/bikablo/about/,"Bikablo is a design service firm that offers training and products for visual storytelling, graphic recording, visual facilitation, and visual consulting. It specializes in graphic recording, sketch noting, and visual dictionary for academic courses and industries. Bikablo also organizes training courses for beginners, advanced learners, and subject specialists.","Design, Education, Software",,11-50,,,,,,,,,,,,,,,,,,,,,,,,,,,,,,,,,,,Private,,,,,,,,,,,
Laser Melting Innovations,https://www.crunchbase.com/organization/laser-melting-innovations,Active,,"Laser, Manufacturing","Aachen, Nordrhein-Westfalen, Germany",LMI is the first supplier of 3D printers for metal components that small and medium-sized businesses can afford,"991,414","European Union (EU), Europe, Middle East, and Africa (EMEA)",52074,,2017-01-01,year,,,,,For Profit,https://www.lm-innovations.com/de-de/,,https://www.facebook.com/3dlmi/?ref=page_internal,,LMI is the first supplier of 3D printers for metal components that small and medium-sized businesses can afford. Laser Melting Innovations (LMI) is committed to making it easier for companies of all types and sizes to access innovative additive manufacturing processes.,"Hardware, Manufacturing, Science and Engineering",,,,,,,,,,,,,,,,,,,,,,,,,,,,,,,,,,,,,Private,,,,,,,,,,,
BiOBUDDi,https://www.crunchbase.com/organization/biobuddi,Active,,"E-Commerce, Toys","Venlo, Limburg, The Netherlands",BiOBUDDi is an online store of toy sets in the Netherlands.,"1,000,466","European Union (EU), Europe, Middle East, and Africa (EMEA)",,$10M to $50M,2017-01-01,year,,,,,For Profit,https://biobuddi.com,https://twitter.com/Bio_Buddi,https://www.facebook.com/biobuddi,https://www.linkedin.com/company/biobuddi,,"Commerce and Shopping, Consumer Goods",,11-50,,,,,,,,,,,,,,,,,,,,,,,,,,,,,,,,,,,Private,,,,,,,,,,,
Complane,https://www.crunchbase.com/organization/complane,Active,,"Air Transportation, Customer Service, Government","Bonn, Nordrhein-Westfalen, Germany",Complane is a flight check list platform that offers flight delay and cancellation information.,"1,011,607","European Union (EU), Europe, Middle East, and Africa (EMEA)",53127,$1M to $10M,2017-01-01,year,,,,,For Profit,https://complane.de,https://x.com/ComplaneDe,https://www.facebook.com/complane.de/,,,"Government and Military, Other, Professional Services, Transportation",,11-50,,,,,,,,,,,,,,,,,,,,,,,,,,,,,,,,,,,Private,,,,,,,,,,,
Calculus,https://www.crunchbase.com/organization/calculus,Active,,,"Zutendaal, Limburg, Belgium",Calculus is a proprietary measurement platform that offers tools for asset monitoring services.,"1,020,573","European Union (EU), Europe, Middle East, and Africa (EMEA)",3690,,2017-01-01,year,,,,,For Profit,https://www.calculus.group,https://twitter.com/Calculu68399525,https://www.facebook.com/calculusgrp,https://www.linkedin.com/company/calculusgroup,,,,11-50,,,,,,,,,,,,,,,,,,,,,,,,,,,,,,,,,,,Private,,,,,,,,,,,
insoro GmbH,https://www.crunchbase.com/organization/insoro,Closed,,"Financial Services, FinTech, Information Technology, Software, Wealth Management","Köln, Nordrhein-Westfalen, Germany",Insoro is a finance software platform for investment professionals.,"1,025,301","European Union (EU), Europe, Middle East, and Africa (EMEA)",,,2017-01-01,year,,,2023-09-26,day,For Profit,https://www.insoro.com/,,,https://www.linkedin.com/company/insoro/,,"Financial Services, Information Technology, Software",2,11-50,"Benedikt Schulz, Christian Rokitta",1,Seed,2018-06-01,,,,Seed,,,,Seed,,,,,,,STARTPLATZ,1,1,,,,,,,,,,,,,,Private,,,,,,,,,,,
Elipsys,https://www.crunchbase.com/organization/elipsys,Active,,"Apps, Cloud Computing, Consulting, Web Development","Huy, Liege, Belgium","Elipsys is an IT company that specializes in application development, consultancy, systems administration, and cloud computing services.","1,026,468","European Union (EU), Europe, Middle East, and Africa (EMEA)",4500,$1M to $10M,2017-01-01,year,,,,,For Profit,https://elipsys.be/,https://twitter.com/ElipsysSPRL,https://www.facebook.com/elipsys,https://www.linkedin.com/company/elipsys-sprl/,,"Apps, Internet Services, Professional Services, Software",,1-10,,,,,,,,,,,,,,,,,,,,,,,,,,,,,,,,,,,Private,,,,,,,,,,,
Jcfinch,https://www.crunchbase.com/organization/jcfinch,Active,,"Consulting, Human Resources, Recruiting","Düsseldorf, Nordrhein-Westfalen, Germany",Jcfinch is a human resource consulting company that offers employment solutions for various sectors.,"1,026,984","European Union (EU), Europe, Middle East, and Africa (EMEA)",94043,$1M to $10M,2017-01-01,year,,,,,For Profit,https://jcfinch.com/,,,https://www.linkedin.com/company/jcfinch/,,"Administrative Services, Professional Services",1,1-10,Christian Finke,,,,,,,,,,,,,,,,,,,,,,,,,,,,,,,,,,Private,,,,,,,,,,,
Webmatic,https://www.crunchbase.com/organization/webmatic,Active,,"SEO, Web Design, Web Development","Tongeren, Limburg, Belgium","Webmatic is a design agency that specializes in web development, web design, SEO, graphic design, branding, and WordPress maintenance.","1,032,168","European Union (EU), Europe, Middle East, and Africa (EMEA)",,,2017-01-01,day,,,,,For Profit,https://www.webmatic.be,https://twitter.com/webmaticdesign,https://www.facebook.com/wmtic/,https://www.linkedin.com/company/webmaticdesign/?originalSubdomain=in,,"Design, Internet Services, Sales and Marketing, Software",,1-10,,,,,,,,,,,,,,,,,,,,,,,,,,,,,,,,,,,Private,,,,,,,,,,,
Aries Mobile,https://www.crunchbase.com/organization/aries-mobile,Active,,"Enterprise Resource Planning (ERP), Fuel, Information Technology, Oil and Gas, Software","Würselen, Nordrhein-Westfalen, Germany",Aries Mobile is a heating oil dealer ERP system.,"1,053,998","European Union (EU), Europe, Middle East, and Africa (EMEA)",52146,$1M to $10M,2017-01-01,year,,,,,For Profit,https://aries-mobile.de,,https://www.facebook.com/AriesmobileGmbH,https://www.linkedin.com/company/aries-mobile,"Aries mobile is a company that provides software solutions for warehouse, shipping, controlling, and cube for the areas of logistics, controlling, and production data acquisition. They offer logistics solutions for the company. They provide their sugar software products as SaaS solutions in addition to the classic local installation.","Energy, Information Technology, Natural Resources, Software",,1-10,,,,,,,,,,,,,,,,,,,,,,,,,,,,,,,,,,,Private,,,,,,,,,,,
gasido,https://www.crunchbase.com/organization/gasido,Active,,"Industrial, Oil and Gas, Small and Medium Businesses","Cologne, Nordrhein-Westfalen, Germany",gasido is a procurement platform for industrial gases.,"1,057,469","European Union (EU), Europe, Middle East, and Africa (EMEA)",,,2017-01-01,year,,,,,For Profit,https://www.gasido.de,,,https://www.linkedin.com/company/gasidogmbhi.g.,"gasido offers industrial gases. These include liquid gases like liquid nitrogen as well as rarer gases like argon, carbon dioxide, helium, nitrogen, and oxygen. Technical gases, medical gases, food gases, dry ice, liquid nitrogen, specialty gases, gas bottle bundles, and heating gases are among their offerings. In addition, their service is directly used by 55% of all DAX 40 enterprises.","Energy, Manufacturing, Natural Resources, Other",,1-10,,1,Seed,2018-05-16,,,,Pre-Seed,,,,Pre-Seed,,,,,,,NCA,,1,,,,,,,,,,,,,,Private,,,,,,,,,,,
Flowcite,https://www.crunchbase.com/organization/flowcite,Active,,"Apps, Education, Publishing","Düsseldorf, Nordrhein-Westfalen, Germany","Flowcite offers all research management tools on a single platform including writing, editing, and publishing.","1,058,482","European Union (EU), Europe, Middle East, and Africa (EMEA)",40489,,2017-01-01,year,,,,,For Profit,https://flowcite.com,https://twitter.com/flowcitecom,https://www.facebook.com/flowcitecom/,https://www.linkedin.com/company/flowcite/,,"Apps, Content and Publishing, Education, Media and Entertainment, Software",,101-250,,,,,,,,,,,,,,,,,,,,,,,,,,,,,,,,,,,Private,,,,,,,,,,,
Best Care Solutions,https://www.crunchbase.com/organization/best-care-solutions,Active,,"Customer Service, Health Care, Management Consulting, Medical","Düsseldorf, Nordrhein-Westfalen, Germany",Best Care Solutions is a management company for the medical and healthcare industry.,"1,070,017","European Union (EU), Europe, Middle East, and Africa (EMEA)",40591,Less than $1M,2017-01-01,year,,,,,For Profit,https://www.bestcaresolutions.de,,,,,"Health Care, Other, Professional Services",,1-10,,,,,,,,,,,,,,,,,,,,,,,,,,,,,,,,,,,Private,,,,,,,,,,,
Pointreef,https://www.crunchbase.com/organization/pointreef,Active,,3D Technology,"Düsseldorf, Nordrhein-Westfalen, Germany",Pointreef is a 3D production company.,"1,077,939","European Union (EU), Europe, Middle East, and Africa (EMEA)",40210,,2017-01-01,year,,,,,For Profit,https://pointreef.de/,,,https://www.linkedin.com/company/pointreef,"Pointreef is a 3D production company founded in 2017 that deals with the three-dimensional digitization of objects and existing buildings. Using modern 3D scanning technology, pointreef is able to generate millimeter-accurate digital data models in unlimited dimensions from real-world environments. The recorded data is processed customer-oriented and individually for the areas of architecture, marketing or culture as a 3D model or VR applications. This enables us to make inaccessible places virtually accessible, to archive demolition-threatened building structures in 3D or to develop a digital twin of buildings in order to plan renovations or events.","Hardware, Software",,,,,,,,,,,,,,,,,,,,,,,,,,,,,,,,,,,,,Private,,,,,,,,,,,1
ALL IN - Artist Management,https://www.crunchbase.com/organization/all-in-artist-management,Active,,"Celebrity, Marketing, Social Media","Cologne, Nordrhein-Westfalen, Germany",ALL IN - Artist Management is a Talent agency that offers artist management and influencer marketing services for content creators.,"1,097,861","European Union (EU), Europe, Middle East, and Africa (EMEA)",50670,$1M to $10M,2017-01-01,year,,,,,For Profit,https://www.all-in.social,,https://www.facebook.com/profile.php?id=100064524476246,https://www.linkedin.com/company/allinmgmt/,,"Internet Services, Media and Entertainment, Sales and Marketing",,11-50,,,,,,,,,,,,,,,,,,,,,,,,,,,,,,,,,,,Private,,,,,,,,,,,
Underdock,https://www.crunchbase.com/organization/underdock,Active,,"Consulting, Digital Marketing, Digital Signage","Düsseldorf, Nordrhein-Westfalen, Germany",Underdock provides bespoke services to solve business needs.,"1,126,615","European Union (EU), Europe, Middle East, and Africa (EMEA)",40221,$1M to $10M,2017-01-01,year,,,,,For Profit,http://www.underdock.net,,,https://www.linkedin.com/company/underdock-net/,"Underdock is the digital transformation of creativity driven process based on unique knowledge, decades of experience and synergetic partnerships in retail business worldwide. Creative production services and solutions with unique expertise and decades of experience. Made real by creative production hub.","Professional Services, Sales and Marketing",,1-10,,,,,,,,,,,,,,,,,,,,,,,,,,,,,,,,,,,Private,,,,,,,,,,,
Turnaround Management Partners,https://www.crunchbase.com/organization/turnaround-management-partners,Active,,"Consulting, Management Consulting, Training","Düsseldorf, Nordrhein-Westfalen, Germany",Turnaround Management Partners is a consulting firm that provides strategic assistance and restructuring services for organizations.,"1,133,503","European Union (EU), Europe, Middle East, and Africa (EMEA)",,,2017-01-01,year,,,,,For Profit,https://turnaround.management/,,,https://www.linkedin.com/company/turnaround-management-partners/,,"Education, Professional Services",,11-50,,,,,,,,,,,,,,,,,,,,,,,,,,,,,,,,,,,Private,,,,,,,,,,,
Exco-Software,https://www.crunchbase.com/organization/exco-software,Active,,"Information Technology, Mobile Apps, Software, Web Development","Maastricht, Limburg, The Netherlands","Exco-Software is an IT company that expertise in software development, web development and mobile application development.","1,139,404","European Union (EU), Europe, Middle East, and Africa (EMEA)",,Less than $1M,2017-01-01,month,,,,,For Profit,https://www.exco-software.org/,,https://www.facebook.com/excosoftware/,https://www.linkedin.com/company/exco-software/,,"Apps, Information Technology, Mobile, Software",,1-10,,,,,,,,,,,,,,,,,,,,,,,,,,,,,,,,,,,Private,,,,,,,,,,,
iuvo Therapeutics,https://www.crunchbase.com/organization/iuvo-therapeutics,Active,,,"Düsseldorf, Nordrhein-Westfalen, Germany",iuvo Therapeutics is a pharmaceutical company focused on providing a portfolio of medical cannabis products for European patients.,"1,140,507","European Union (EU), Europe, Middle East, and Africa (EMEA)",40210,,2017-01-01,year,,,,,For Profit,https://iuvo-therapeutics.com/,,,https://www.linkedin.com/company/iuvo-therapeutics-gmbh,"iuvo Therapeutics Limited is a pharmaceutical company focused on providing a diversified portfolio of medical cannabis products for European patients and, within the German territory, has access to over 20,000 pharmacies.",,,,,,,,,,,,,,,,,,,,,,,,,,,,,,,,,,,,,,Private,,,,,,,,,,,
BouwmachineWeb.com,https://www.crunchbase.com/organization/bouwmachineweb-com,Active,,"Construction, News, Online Portals","Geleen, Limburg, The Netherlands",BouwmachineWeb.com is an online portal that delivers news on construction machines and heavy transport.,"1,144,385","European Union (EU), Europe, Middle East, and Africa (EMEA)",,Less than $1M,2017-01-01,day,,,,,For Profit,http://bouwmachineweb.com,https://www.twitter.com/BouwmachineWeb,https://www.facebook.com/BouwmachineWebcom/,https://www.linkedin.com/company/bouwmachineweb.com/,,"Content and Publishing, Internet Services, Media and Entertainment, Real Estate",,1-10,,,,,,,,,,,,,,,,,,,,,,,,,,,,,,,,,,,Private,,,,,,,,,,,
Yungo,https://www.crunchbase.com/organization/yungo,Active,,"Advertising, Email Marketing, Graphic Design, Social Media","Genk, Limburg, Belgium","Yungo provides corporate identity, graphic design, advertising, social media, branding, and email marketing services.","1,153,441","European Union (EU), Europe, Middle East, and Africa (EMEA)",3600,Less than $1M,2017-01-01,year,,,,,For Profit,https://yungo.be,,https://www.facebook.com/yungosocialmedia/,https://www.linkedin.com/company/yungo-socialmedia/?originalSubdomain=be,,"Advertising, Design, Internet Services, Media and Entertainment, Sales and Marketing",,11-50,,,,,,,,,,,,,,,,,,,,,,,,,,,,,,,,,,,Private,,,,,,,,,,,
ApoSync,https://www.crunchbase.com/organization/aposync,Active,,"Health Care, Pharmaceutical","Haan, Nordrhein-Westfalen, Germany",The app to facilitate the organization of daily tasks within pharmacy teams,"1,163,046","European Union (EU), Europe, Middle East, and Africa (EMEA)",42781,,2017-01-01,year,2020-04-01,month,,,For Profit,https://www.aposync.de/,,,https://www.linkedin.com/company/aposync,,Health Care,,1-10,,,M&A,,,,,,,,,,,,,,,,,,,,Was Acquired,ApoSync acquired by ARZ Haan AG,https://www.crunchbase.com/acquisition/arz-haan-ag-acquires-aposync--2cf54837,ARZ Haan AG,https://www.crunchbase.com/organization/arz-haan-ag,2020-04-01,month,,,,,,Private,,,,,,,,,,,
BodyGraph,https://www.crunchbase.com/organization/bodygraph,Closed,,"Artificial Intelligence (AI), Fitness, Health Care, Machine Learning, Medical, Product Design, Sports","Baexem, Limburg, The Netherlands",BodyGraph is a healthcare technologies.,"1,168,349","European Union (EU), Europe, Middle East, and Africa (EMEA)",6095PC,,2017-01-01,year,,,,none,For Profit,https://www.body-graph.com,,https://www.facebook.com/bodygraph/,https://www.linkedin.com/company/bodygraph/,BodyGraph is the first company in the world which combines the Smart Wearable and Smart Textile technologies by integrating a lot of different sensors into clothing. With the use of Machine Learning and other Deep Learning algorithms our smart clothing is able to learn from its user and gives more precise feedback back to the user and notify when it recognizes an anomaly. Our product can be used by professional athletes and coaches but also by people who are curious about their (healthy) life.,"Artificial Intelligence (AI), Data and Analytics, Design, Health Care, Science and Engineering, Software, Sports",1,1-10,Alexander Kievits,,,,,,,,,,,,,,,,,,,,,,,,,,,,,,,,,,Private,,,,,,,,,,,
Digitalyze,https://www.crunchbase.com/organization/digitalyze,Active,,"Lead Generation, Marketing, Photography, Software, Web Design","Düsseldorf, Nordrhein-Westfalen, Germany","Digitalyze is a digital agency that provides websites, online marketing, and e-commerce services.","1,189,079","European Union (EU), Europe, Middle East, and Africa (EMEA)",40212,,2017-01-01,year,,,,,For Profit,https://digitalyze.io,https://twitter.com/digitalyze_io,https://www.facebook.com/digitalyze,https://www.linkedin.com/company/digitalyze,"Digitalyze offers solutions for digital marketing, web and mobile applications, brand development, and online marketing that will boost sales. The services include film, photography, market positioning, branding, lead generation, recruitment, web design, and CMS development.","Content and Publishing, Design, Media and Entertainment, Sales and Marketing, Software",,1-10,,,,,,,,,,,,,,,,,,,,,,,,,,,,,,,,,,,Private,,,,,,,,,,,
Befeni GmbH,https://www.crunchbase.com/organization/befeni-gmbh,Active,,"Fashion, Food and Beverage, Manufacturing, Product Design, Web Design","Langenfeld, Rheinland-Pfalz, Germany",Befeni is a textile and clothing company that manufactures dress shirts are made in our their manufactory.,"1,190,963","European Union (EU), Europe, Middle East, and Africa (EMEA)",0764,,2017-01-01,year,,,,,For Profit,http://www.befeni.de,,,https://www.linkedin.com/company/befeni-gmbh,"Befeni is a textile and clothing company that manufactures dress shirts are made in our their manufactory. The Befeni team can look back on more than 10 years of experience in tailor-made textiles. By working exclusively with seasoned tailors in Asia and our local German production manager, the company is able to offer consistently consistent and high quality. It offers extremely high standards of cleanliness, free drinks, food subsidies, as well as joint employee events with management and management that are completely unheard of in Asia.","Clothing and Apparel, Design, Food and Beverage, Manufacturing",1,11-50,Philip Kamp,1,Seed,2017-04-05,,,,Seed,,,,Seed,,,,,,,,,,,,,,,,,,,,,,,Private,,,,,,,,,,,
Sprungwerk,https://www.crunchbase.com/organization/sprungwerk,Active,,Innovation Management,"Cologne, Nordrhein-Westfalen, Germany",Sprungwerk GmbH is an innovative start-up company for business process outsourcing.,"1,215,017","European Union (EU), Europe, Middle East, and Africa (EMEA)",50670,,2017-01-01,year,,,,,For Profit,https://www.sprungwerk.net,,,https://www.linkedin.com/company/sprungwerk-gmbh,,Professional Services,1,1-10,Oliver D. Förster,,,,,,,,,,,,,,,,,,,,,,,,,,,,,,,,,,Private,,,,,,,,,,,
Bosbach Consulting,https://www.crunchbase.com/organization/bosbach-consulting,Active,,"Career Planning, Consulting, Training","Erkrath, Nordrhein-Westfalen, Germany","BOSBACH Consulting offers digital consulting for the real estate industry, focusing on brokerage success and career growth.","1,221,680","European Union (EU), Europe, Middle East, and Africa (EMEA)",40699,$1M to $10M,2017-01-01,year,,,,,For Profit,https://www.bosbach-consulting.de,,,https://www.linkedin.com/company/bosbachconsulting,"BOSBACH Consulting specializes in providing digital consulting services tailored to the real estate industry. With a focus on enhancing the success of real estate brokerage businesses, the company offers strategies for increasing revenue and recognition within the sector. BOSBACH Consulting is committed to offering career advancement opportunities in a growing industry, aiming to attract capable individuals looking for upward mobility. Founded by Heinz Bosbach, who has over three decades of experience in real estate, the company positions itself as a pioneer in digital consulting for real estate, leveraging extensive industry knowledge to support its clients' business growth and customer engagement.","Education, Professional Services",,1-10,,,,,,,,,,,,,,,,,,,,,,,,,,,,,,,,,,,Private,,,,,,,,,,,
PITMAN Solutions,https://www.crunchbase.com/organization/pitman-solutions,Active,,"Consulting, Information Technology, Software","Köln, Nordrhein-Westfalen, Germany",PITMAN Solutions supports organizations through operational implementation and digital transformation.,"1,230,587","European Union (EU), Europe, Middle East, and Africa (EMEA)",,$1M to $10M,2017-01-01,year,,,,,For Profit,https://pitman-solutions.com,https://twitter.com/pitmansolutions,https://www.facebook.com/profile.php?id=100063787232133,https://www.linkedin.com/company/pitmansolutions,,"Information Technology, Professional Services, Software",1,1-10,Jonas Warmbrunn,,,,,,,,,,,,,,,,,,,,,,,,,,,,,,,,,,Private,,,,,,,,,,,
DUMBO,https://www.crunchbase.com/organization/dumbo,Active,,"Graphic Design, UX Design, Web Design","Cologne, Nordrhein-Westfalen, Germany","DUMBO specializes in digital product design, UX/UI, and experience strategy.","1,261,758","European Union (EU), Europe, Middle East, and Africa (EMEA)",NRW50935,$1M to $10M,2017-01-01,year,,,,,For Profit,https://dumbo.design,,,https://www.linkedin.com/company/dumbo,"DUMBO is a digital design agency based in Cologne, specializing in creating digital product designs and experience strategies. The company focuses on user experience (UX), user interface (UI), interaction, and service design. DUMBO aims to craft digital solutions that enhance user interaction and engagement through meticulously designed interfaces and experiences. With a team of professionals, DUMBO works across various industries to deliver digital products that meet the evolving needs of businesses and their customers. The agency also emphasizes legal compliance and data processing transparency, as outlined in its legal notice.",Design,,11-50,,,,,,,,,,,,,,,,,,,,,,,,,,,,,,,,,,,Private,,,,,,,,,,,
Bright Circle,https://www.crunchbase.com/organization/bright-circle,Active,,"Advertising, Digital Marketing, Web Design, Web Development","Venray, Limburg, The Netherlands","Bright Circle provides online marketing, web development and web design services.","1,270,468","European Union (EU), Europe, Middle East, and Africa (EMEA)",,Less than $1M,2017-01-01,day,,,,,For Profit,https://brightcircle.nl/,https://www.twitter.com/brightcircle_nl,https://www.facebook.com/BrightCircleNederland/,https://www.linkedin.com/company/brigth-circle/,,"Advertising, Design, Sales and Marketing, Software",,1-10,,,,,,,,,,,,,,,,,,,,,,,,,,,,,,,,,,,Private,,,,,,,,,,,
Viamonda,https://www.crunchbase.com/organization/viamonda,Active,,"Online Portals, Recreation, Tourism","Köln, Nordrhein-Westfalen, Germany","Viamonda is an online portal that provides a wide range of customized personal trips, and rental car tour services worldwide.","1,271,314","European Union (EU), Europe, Middle East, and Africa (EMEA)",50858,$1M to $10M,2017-01-01,year,,,,,For Profit,https://www.viamonda.de/,https://mobile.twitter.com/viamondatravel,,https://www.linkedin.com/company/viamonda/,,"Internet Services, Sports, Travel and Tourism",1,1-10,Michael Tenzer,,,,,,,,,,,,,,,,,,,,,,,,,,,,,,,,,,Private,,,,,,,,,,,
TJWeb,https://www.crunchbase.com/organization/tjweb,Active,,"Consulting, E-Commerce, SEO, Social Media Marketing, Web Design","Bedburg, Nordrhein-Westfalen, Germany","TJWeb offers web design, online shops, and digital consulting services for small businesses.","1,272,630","European Union (EU), Europe, Middle East, and Africa (EMEA)",,,2017-01-01,year,,,,,For Profit,https://tjweb.eu,,https://www.facebook.com/profile.php?id=100083348307765,https://www.linkedin.com/company/tjweb,,"Commerce and Shopping, Design, Internet Services, Professional Services, Sales and Marketing",1,1-10,Thomas Joppien,,,,,,,,,,,,,,,,,,,,,,,,,,,,,,,,,,Private,,,,,,,,,,,
GEORGE pakketbrievenbussen,https://www.crunchbase.com/organization/george-pakketbrievenbussen,Active,,"Freight Service, Packaging Services","Hasselt, Limburg, Belgium",GEORGE pakketbrievenbussen is the Freight and Package Transportation company.,"1,291,107","European Union (EU), Europe, Middle East, and Africa (EMEA)",3500,,2017-01-01,year,,,,,For Profit,https://pakketboxen.be,,https://www.facebook.com/georgepakketbrievenbussen,https://www.linkedin.com/company/george-pakketbrievenbussen,"GEORGE's company mission is to provide an answer to the last-mile challenges of parcel delivery. The convenience of the consumer is central here, with a minimal impact on society as the goal.","Administrative Services, Transportation",1,1-10,Tom Claes,,,,,,,,,,,,,,,,,,,,,,,,,,,,,,,,,,Private,,,,,,,,,,,
