Continuous Professionals,https://www.crunchbase.com/organization/continuous-professionals,Active,,"Employment, Recruiting, Staffing Agency","Genk, Limburg, Belgium",Continuous Professionals is a temporary employment agency that offers recruitment services for the engineering sector.,"1,960,487","European Union (EU), Europe, Middle East, and Africa (EMEA)",3600,$10M to $50M,2016-01-01,year,,,,,For Profit,https://www.continu.be,,https://www.facebook.com/ContinuBE/,https://www.linkedin.com/company/continu-be/,,"Administrative Services, Professional Services",,51-100,,,,,,,,,,,,,,,,,,,,,,,,,,,,,,,,,,,Private,,,,,,,,,,,
MC-Netzwerke,https://www.crunchbase.com/organization/mc-netzwerke,Active,,"Cloud Computing, Consulting, Information Technology, Network Security, Software, Tax Consulting","Cologne, Nordrhein-Westfalen, Germany",MC-Netzwerke is an IT solutions provider for small and medium-sized companies and tax consultants.,"1,983,551","European Union (EU), Europe, Middle East, and Africa (EMEA)",50670,Less than $1M,2016-01-01,year,,,,,For Profit,https://mc-netzwerke.com,,,https://www.linkedin.com/company/digitalisierungsberater/,"MC-Netzwerke offers services relating to IT consulting, EDP solutions, IT security, and data security from a single source. They develop secure and economical IT solutions. Their services include IT support, hardware and software installation, IT solutions, network technology, email archiving, backup and data security, firewalls and security, and server installation and operation.","Financial Services, Information Technology, Internet Services, Privacy and Security, Professional Services, Software",,1-10,,,,,,,,,,,,,,,,,,,,,,,,,,,,,,,,,,,Private,,,,,,,,,,,
GreenSoil Group,https://www.crunchbase.com/organization/greensoil-group,Active,,"Environmental Engineering, Rehabilitation, Sustainability","Genk, Limburg, Belgium","Greensoil Group is an environmental company that offers soil remediation, above-ground treatment, and contamination services.","1,994,624","European Union (EU), Europe, Middle East, and Africa (EMEA)",3600,$1M to $10M,2016-01-01,year,,,,,For Profit,https://www.greensoilgroup.com,,,https://www.linkedin.com/company/greensoil-group-br/,,"Health Care, Science and Engineering, Sustainability",,11-50,,,,,,,,,,,,,,,,,,,,,,,,,,,,,,,,,,,Private,,,,,,,,,,,
Gremse-IT,https://www.crunchbase.com/organization/gremse-it,Active,,"Image Recognition, Medical, Software","Aachen, Nordrhein-Westfalen, Germany",Gremse-IT specializes in biomedical image processing and offers the Imalytics Preclinical software.,"1,994,756","European Union (EU), Europe, Middle East, and Africa (EMEA)",52068,,2016-01-01,year,,,,,For Profit,https://gremse-it.com,https://x.com/GremseIT,,https://www.linkedin.com/company/gremse-it,,"Data and Analytics, Health Care, Software",,11-50,,,,,,,,,,,,,,,,,,,,,,,,,,,,,,,,,,,Private,,,,,,,,,,,
Shippion,https://www.crunchbase.com/organization/shippion,Active,,"Freight Service, Marketplace, Shipping","Düsseldorf, Nordrhein-Westfalen, Germany",Shippion is an online marketplace for exporters to compare and book export cargo.,"2,000,524","European Union (EU), Europe, Middle East, and Africa (EMEA)",40589,Less than $1M,2016-01-01,year,,,,,For Profit,https://www.shippion.com,,,https://www.linkedin.com/company/shippion.com/,Shippion provides service for exporters looking to export through ocean or air only. The exporter can enter the load details on the portal. The website then shows various freight forwarders and 3PL players which can provide the service. The exporter is provided with all-in-prices and customer ratings for each service provider. The exporter can then choose the preferred service and book through the platform itself. Also allows tracking of shipments.,"Commerce and Shopping, Transportation",1,1-10,Lasse Keldorf Jensen,,,,,,,,,,,,,,,,,,,,,,,,,,,,,,,,,,Private,,,,,,,,,,,
MD-IT,https://www.crunchbase.com/organization/md-it-a80b,Active,,"Information Technology, Software, Web Design","Eygelshoven, Limburg, The Netherlands","MD-IT provides web design, IT, computer repair, hardware and software solutions to small and medium businesses.","2,014,484","European Union (EU), Europe, Middle East, and Africa (EMEA)",,Less than $1M,2016-01-01,year,,,,,For Profit,http://www.md-solutions.nl,https://twitter.com/MD_Solutions16,https://www.facebook.com/pg/MDSolutions.nl/,https://www.linkedin.com/company/md-solutions-nl/,,"Design, Information Technology, Software",,1-10,,,,,,,,,,,,,,,,,,,,,,,,,,,,,,,,,,,Private,,,,,,,,,,,
Rhein/Ruhr Fittings Service,https://www.crunchbase.com/organization/rhein-ruhr-fittings-service,Active,,"Customer Service, Industrial, Mechanical Engineering","Rheinberg, Nordrhein-Westfalen, Germany","Rhein/Ruhr Fittings Service offers maintenance, repair, and assembly of common industrial and control valves.","2,018,591","European Union (EU), Europe, Middle East, and Africa (EMEA)",47495,$1M to $10M,2016-01-01,year,,,,,For Profit,https://rheinruhras.com,,,https://www.linkedin.com/company/rhein-ruhr-armaturenservice-gmbh,,"Manufacturing, Other, Professional Services, Science and Engineering",,11-50,,,,,,,,,,,,,,,,,,,,,,,,,,,,,,,,,,,Private,,,,,,,,,,,
Frontend Solutions,https://www.crunchbase.com/organization/frontend-solutions,Active,,"CRM, Sales Automation, Software","Bonn, Nordrhein-Westfalen, Germany",Frontend Solutions is a CRM and salesforce agency.,"2,028,529","European Union (EU), Europe, Middle East, and Africa (EMEA)",53229,Less than $1M,2016-01-01,year,,,,,For Profit,https://www.frontendsolutions.de,,https://www.facebook.com/pages/Frontend-Solutions-GmbH/394160314337494,https://www.linkedin.com/company/frontend-solutions-gmbh/,"Frontend Solutions is a salesforce and CRM agency. They provide salesforce consulting, salesforce programming, and salesforce integration. They will assist customers in setting up their salesforce environments and answer any salesforce-related questions that they may have. In order to map business operations properly, their technical and UX professionals create custom salesforce modules for customers. Their programmers and architects will seamlessly integrate salesforce with their non-salesforce infrastructure.","Information Technology, Sales and Marketing, Software",,1-10,,,,,,,,,,,,,,,,,,,,,,,,,,,,,,,,,,,Private,,,,,,,,,,,
Netvaerk,https://www.crunchbase.com/organization/netvaerk,Active,,"Employment, Recruiting, Staffing Agency","Köln, Nordrhein-Westfalen, Germany",Netvaerk is a recruiting service that specializes in providing employment opportunities in a variety of industries.,"2,033,388","European Union (EU), Europe, Middle East, and Africa (EMEA)",,,2016-01-01,year,,,,,For Profit,https://www.netvaerk.de,,https://www.facebook.com/netvaerk,https://www.linkedin.com/company/netvaerk-gmbh-co-kg,,"Administrative Services, Professional Services",,11-50,,,,,,,,,,,,,,,,,,,,,,,,,,,,,,,,,,,Private,,,,,,,,,,,
Cent Pure Cent,https://www.crunchbase.com/organization/cent-pure-cent,Active,,"Beauty, Cosmetics, E-Commerce, Manufacturing","Hasselt, Limburg, Belgium",Cent Pure Cent manufactures and sells cosmetics and skincare products.,"2,041,465","European Union (EU), Europe, Middle East, and Africa (EMEA)",3500,$1M to $10M,2016-01-01,year,,,,,For Profit,https://centpurcent.com,https://twitter.com/cent_pur,https://www.facebook.com/centpurcent,https://www.linkedin.com/company/centpurcent,,"Commerce and Shopping, Consumer Goods, Manufacturing",,11-50,,,,,,,,,,,,,,,,,,,,,,,,,,,,,,,,,,,Private,,,,,,,,,,,
FiberSol,https://www.crunchbase.com/organization/fibersol-a074,Active,,"Manufacturing, Plastics and Rubber Manufacturing, Training","Eschweiler, Nordrhein-Westfalen, Germany",FiberSol is a manufacturing company providing glass reinforced plastic pipes.,"2,054,753","European Union (EU), Europe, Middle East, and Africa (EMEA)",52249,$1M to $10M,2016-01-01,year,,,,,For Profit,https://www.fibersol.de,,,https://www.linkedin.com/company/fibersol-group/,,"Education, Manufacturing",,51-100,,,,,,,,,,,,,,,,,,,,,,,,,,,,,,,,,,,Private,,,,,,,,,,,
Insurers.ai,https://www.crunchbase.com/organization/insurers-ai,Active,,"Artificial Intelligence (AI), Information Technology, Insurance, Machine Learning","Cologne, Nordrhein-Westfalen, Germany",insurers.ai is offering AI services and developing custom AI solutions.,"2,060,125","European Union (EU), Europe, Middle East, and Africa (EMEA)",50670,,2016-01-01,year,,,,,For Profit,http://insurers.ai,https://twitter.com/insurersAI,https://www.facebook.com/insurersAI,https://www.linkedin.com/company/10940462,,"Artificial Intelligence (AI), Data and Analytics, Financial Services, Information Technology, Science and Engineering, Software",1,1-10,Babak Ahmadi,,,,,,,,,,,,,,,,,,,,,,,,,,,,,,,,,,Private,,,,,,,,,,,
Ewomis,https://www.crunchbase.com/organization/ewomis,Active,,"Biotechnology, Health Care","Aachen, Nordrhein-Westfalen, Germany",Technology that provides innovative animal component-free reagents for your in vitro metabolisation,"2,062,035","European Union (EU), Europe, Middle East, and Africa (EMEA)",52074,,2016-01-01,year,,,,,For Profit,http://ewomis.com/,,,,,"Biotechnology, Health Care, Science and Engineering",1,,Andreas Schiwy,,,,,,,,,,,,,,,,,,,,,,,,,,,,,,,,,,Private,,,,,,,,,,,
digitalhoneycomb,https://www.crunchbase.com/organization/digitalhoneycomb,Active,,"Digital Marketing, SEM, Social Media Marketing","Willich, Nordrhein-Westfalen, Germany","digitalhoneycomb specialzies in online marketing for more sales, social media advertising, and Google Ads.","2,083,862","European Union (EU), Europe, Middle East, and Africa (EMEA)",,,2016-01-01,year,,,,,For Profit,https://digitalhoneycomb.de,,https://www.facebook.com/digitalhoneycomb,https://www.linkedin.com/company/digitalhoneycomb,,"Advertising, Internet Services, Sales and Marketing",,1-10,,,,,,,,,,,,,,,,,,,,,,,,,,,,,,,,,,,Private,,,,,,,,,,,
Screenware,https://www.crunchbase.com/organization/screenware,Active,,"B2B, Software","Viersen, Nordrhein-Westfalen, Germany",Screenware is a startup in developing and running B2B software and web portals.,"2,096,086","European Union (EU), Europe, Middle East, and Africa (EMEA)",,,2016-01-01,year,,,,,For Profit,https://www.screenware.eu,,https://www.facebook.com/screenware,https://www.linkedin.com/company/screenware-gmbh-&-co.-kg,"Screenware develops and runs simulation, calculation as well as search and exchange programs in form of software or web portals. It enables the preparation of automatic offers of planning and project development and facilitates new technologies. Additionally, with their partner network, they are a supplier of miscellaneous services.","Other, Software",,,,,,,,,,,,,,,,,,,,,,,,,,,,,,,,,,,,,Private,,,,,,,,,,,
Columbus Group,https://www.crunchbase.com/organization/columbus-group-ab93,Active,,"Advice, Financial Services, Health Care, Health Insurance, Office Administration","Hasselt, Limburg, Belgium",Columbus Group is a wealth planner and financial expert for the medical profession.,"2,098,642","European Union (EU), Europe, Middle East, and Africa (EMEA)",,$1M to $10M,2016-01-01,year,,,,,For Profit,https://www.columbusgroup.be,,https://www.facebook.com/columbusfinancialservice,https://www.linkedin.com/company/columbusgroupbelgium,,"Administrative Services, Financial Services, Health Care, Media and Entertainment",1,11-50,John Abdul,,,,,,,,,,,,,,,,,,,,,,,,,,,,,,,,,,Private,,,,,,,,,,,
Kamano,https://www.crunchbase.com/organization/kamano,Active,,"Brand Marketing, Digital Marketing, UX Design","Köln, Nordrhein-Westfalen, Germany",Kamano is a design agency that provides a wide range of services such as digital brand strategy and user experience design.,"2,098,852","European Union (EU), Europe, Middle East, and Africa (EMEA)",D-50672,$1M to $10M,2016-01-01,year,,,,,For Profit,https://kamano.de,,,https://www.linkedin.com/company/kamano/,,"Design, Sales and Marketing",2,11-50,"Marlon Damm, Philipp Vaerst",,,,,,,,,,,,,,,,,,,,,,,,,,,,,,,,,,Private,,,,,,,,,,,
YOUPILA Studios,https://www.crunchbase.com/organization/youpila-studios,Active,,"Fitness, Training, Wellness, Women's","Düsseldorf, Nordrhein-Westfalen, Germany",YOUPILA Studios provides fitness training courses and workshops for women.,"2,109,897","European Union (EU), Europe, Middle East, and Africa (EMEA)",,$10M to $50M,2016-01-01,year,,,,,For Profit,https://www.youpila.de,,https://www.facebook.com/youpila.studios,https://www.linkedin.com/company/youpila,,"Community and Lifestyle, Education, Health Care, Sports",,11-50,,,,,,,,,,,,,,,,,,,,,,,,,,,,,,,,,,,Private,,,,,,,,,,,
OxyHelp Industry,https://www.crunchbase.com/organization/oxyhelp-industry,Active,,"Manufacturing, Medical","Cologne, Nordrhein-Westfalen, Germany",OxyHelp Industry specializes in the design and manufacture of hyperbaric chambers.,"2,121,504","European Union (EU), Europe, Middle East, and Africa (EMEA)",,,2016-01-01,year,,,,,For Profit,https://oxyhelp.eu,https://twitter.com/oxyhelp,https://www.facebook.com/oxyhelpeu-112274073633379,https://www.linkedin.com/company/oxyhelp-industry,,"Health Care, Manufacturing",,1-10,,,,,,,,,,,,,,,,,,,,,,,,,,,,,,,,,,,Private,,,,,,,,,,,
Puttmee by Kausoft GmbH,https://www.crunchbase.com/organization/kausoft-gmbh,Active,,"Artificial Intelligence (AI), Information Technology, Sports","Cologne, Nordrhein-Westfalen, Germany",Puttmee accelerates the transition to golf enjoyment with an Artificial Intelligence platform designed to simplify golf deep learning.,"2,170,128","European Union (EU), Europe, Middle East, and Africa (EMEA)",50859,,2016-01-01,year,,,,,For Profit,http://puttmee.com,http://twitter.com/puttmee,http://facebook.com/puttmee,https://www.linkedin.com/company/puttmee/,"Puttmee delivers a new approach and unique game experience to millions of people, golfers and non-golfers of any ability, to empower them to play quicker, reach a lower score and instantly fulfills the player’s desire to enjoy golf now.","Artificial Intelligence (AI), Data and Analytics, Information Technology, Science and Engineering, Software, Sports",4,1-10,"Duncan Bell, Samuel Wood, Stephan Hemmers, Thomas Masson",,,,,,,,,,,,,,,,,,,,,,,,,,,,,,,,,,Private,,,,,,,,,,,
RegMed XB,https://www.crunchbase.com/organization/regmed-xb,Active,,"Biotechnology, Health Care, Life Science","Maastricht, Limburg, The Netherlands",RegMed XB is a biotechnology company focusing on regenerative medicine and tissue engineering.,"2,171,232","European Union (EU), Europe, Middle East, and Africa (EMEA)",,$1M to $10M,2016-01-01,year,,,,,For Profit,https://regmedxb.com/,https://www.twitter.com/RegMed_XB,,https://www.linkedin.com/company/regmed-xb,"RegMed XB operates in the biotechnology industry, focusing on regenerative medicine. The company aims to create lifesaving impact for patients from science. Their work involves medical innovation, tissue engineering, and biotech revolution. They are committed to crossing borders in regenerative medicine, aiming to bring about economic growth and healthcare innovation. They offer opportunities for partners to collaborate and contribute to their mission.","Biotechnology, Health Care, Science and Engineering",,101-250,,,,,,,,,,,,,,,,,,,,,,,,,,,,,,,,,,,Private,,,,,,,,,,,
WaschMal,https://www.crunchbase.com/organization/waschmal,Active,,"E-Commerce, Internet","Köln, Nordrhein-Westfalen, Germany",WaschMal is an online laundry service company.,"2,171,247","European Union (EU), Europe, Middle East, and Africa (EMEA)",50825,,2016-01-01,year,,,,,For Profit,http://waschmal.de,,,https://www.linkedin.com/company/waschmal,WaschMal provides mobile and regional online textile cleaning services. They provide an app for booking regional dry cleaning via delivery service or for delivery.,"Commerce and Shopping, Internet Services",,11-50,,2,Seed,2021-08-24,,,,Seed,,,,Seed,,,,,,,Miele,,1,,,,,,,,,,,,,,Private,,,,,,,,,,,
​​Bricklog,https://www.crunchbase.com/organization/bricklog,Active,,"Business Development, Consulting, Management Consulting","Cologne, Nordrhein-Westfalen, Germany",​​Bricklog is a management consulting company that provides process consulting and digitalization services.,"2,195,252","European Union (EU), Europe, Middle East, and Africa (EMEA)",50670,$1M to $10M,2016-01-01,year,,,,,For Profit,https://www.bricklog.de,,,https://www.linkedin.com/company/bricklog-gmbh-&-co-kg/,,Professional Services,,11-50,,,,,,,,,,,,,,,,,,,,,,,,,,,,,,,,,,,Private,,,,,,,,,,,
Weg Zwei,https://www.crunchbase.com/organization/weg-zwei,Active,,"Apps, Location Based Services, Navigation","Aachen, Nordrhein-Westfalen, Germany",WEGZWEI is a mobile apps service company.,"2,201,452","European Union (EU), Europe, Middle East, and Africa (EMEA)",52064,,2016-01-01,year,,,,,For Profit,https://wegzwei.com/,,,https://www.linkedin.com/company/wegzwei,"WEGZWEI is an app for navigation inside buildings. WEGZWEI is extremely easy to use. You experience a new dimension of navigation - and that within buildings.  WEGZWEI is ""like a friendly companion, showing me the way.""  With classic GPS navigation systems, you can at best reach the front door of a large building, but how do you find your destination inside the building? If you do not know the environment, you lose a lot of time - and maybe you even get lost.","Apps, Data and Analytics, Internet Services, Navigation and Mapping, Software",1,,Maaged Mazyek,,,,,,,,,,,,,,,,,,,,,,,,,,,,,,,,,,Private,,,,,,,,,,,
Startnet Services,https://www.crunchbase.com/organization/startnet-services,Active,,"E-Commerce, SEO, Web Design, Web Hosting","Maasmechelen, Limburg, Belgium","Startnet Services is a creative agency that provides web hosting, web design, search engine optimization, and e-commerce services.","2,204,727","European Union (EU), Europe, Middle East, and Africa (EMEA)",3630,,2016-01-01,year,,,,,For Profit,https://startnet-services.be/,,,https://www.linkedin.com/company/startnet.be/,,"Commerce and Shopping, Design, Internet Services, Sales and Marketing",,1-10,,,,,,,,,,,,,,,,,,,,,,,,,,,,,,,,,,,Private,,,,,,,,,,,
TALENT-net,https://www.crunchbase.com/organization/talent-net-6a76,Active,,"Consulting, IT Management, Professional Services, Supply Chain Management","Cologne, Nordrhein-Westfalen, Germany","TALENT-net GmbH specializes in Executive Search, Interim Management, and Consulting in Purchasing.","2,206,653","European Union (EU), Europe, Middle East, and Africa (EMEA)",51107,$10M to $50M,2016-01-01,year,,,,,For Profit,https://www.talent-net.org,,,https://www.linkedin.com/company/talent-net-gmbh,,"Information Technology, Other, Professional Services, Transportation",,11-50,,,,,,,,,,,,,,,,,,,,,,,,,,,,,,,,,,,Private,,,,,,,,,,,
Alessio Analytics,https://www.crunchbase.com/organization/alessio-analytics,Active,,"Analytics, Business Development, Business Intelligence","Düsseldorf, Nordrhein-Westfalen, Germany",Alessio Analytics is a business management consultancy that specializes in digital transformation and data science services.,"2,212,630","European Union (EU), Europe, Middle East, and Africa (EMEA)",40210,$1M to $10M,2016-01-01,year,,,,,For Profit,https://www.alessio-analytics.com,,,https://linkedin.com/company/alessio-analytics,,"Data and Analytics, Professional Services",,1-10,,,,,,,,,,,,,,,,,,,,,,,,,,,,,,,,,,,Private,,,,,,,,,,,
KAPMES Ontwerpbureau,https://www.crunchbase.com/organization/kapmes-ontwerpbureau,Active,,"Creative Agency, Printing, Web Design","Hasselt, Limburg, Belgium","Kapmes is a creative agency that provides services regarding branding, print solutions, and web design.","2,216,473","European Union (EU), Europe, Middle East, and Africa (EMEA)",,,2016-01-01,day,,,,,For Profit,http://www.kapmes.be,,https://www.facebook.com/pg/KAPMESontwerp/about/?ref=page_internal,https://in.linkedin.com/company/kapmes,,"Content and Publishing, Design, Media and Entertainment",,1-10,,,,,,,,,,,,,,,,,,,,,,,,,,,,,,,,,,,Private,,,,,,,,,,,
Pannhausen + Lindener Architekten,https://www.crunchbase.com/organization/pannhausen-lindener,Active,,"Architecture, Construction, Consulting","Köln, Nordrhein-Westfalen, Germany","Pannhausen + Lindener Architekten provides architectural, commercial building, construction management, and planning services.","2,239,698","European Union (EU), Europe, Middle East, and Africa (EMEA)",,$1M to $10M,2016-01-01,year,,,,,For Profit,https://pannhausenlindener.de,,https://www.facebook.com/pannhausenlindener.architekten,https://www.linkedin.com/company/pannhausen-lindener-architekten-gmbh,,"Professional Services, Real Estate",,11-50,,,,,,,,,,,,,,,,,,,,,,,,,,,,,,,,,,,Private,,,,,,,,,,,
Fe:male Leadership Development,https://www.crunchbase.com/organization/fe-male-leadership-development,Active,,"E-Learning, Management Consulting, Training","Köln, Nordrhein-Westfalen, Germany","Fe:male Leadership Development is a management consulting firm that offers coaching, training, and mentoring services for women.","2,246,955","European Union (EU), Europe, Middle East, and Africa (EMEA)",50935,$1M to $10M,2016-01-01,year,,,,,For Profit,https://female-leadership-development.com,,,https://www.linkedin.com/company/female-leadership-development/,,"Education, Professional Services, Software",,11-50,,,,,,,,,,,,,,,,,,,,,,,,,,,,,,,,,,,Private,,,,,,,,,,,
Heldental & Co.,https://www.crunchbase.com/organization/heldental-co,Active,,"E-Learning, Education, Trading Platform, Training","Vaals, Limburg, The Netherlands","Heldental & Co. is a prop trading firm offering trading tools, platforms, and educational resources for traders.","2,258,801","European Union (EU), Europe, Middle East, and Africa (EMEA)",6291 ET,$1M to $10M,2016-01-01,year,,,,,For Profit,https://heldental.com,,https://www.facebook.com/profile.php?id=100084561234653,https://www.linkedin.com/company/heldental,,"Education, Financial Services, Lending and Investments, Software",,101-250,,,,,,,,,,,,,,,,,,,,,,,,,,,,,,,,,,,Private,,,,,,,,,,,
Plankpad,https://www.crunchbase.com/organization/plankpad,Active,,"Fitness, Health Care, Medical Device","Aachen, Nordrhein-Westfalen, Germany","Plankpad helps with back pain, it brings you in shape and you will get six pack abs in no time.","2,264,129","European Union (EU), Europe, Middle East, and Africa (EMEA)",52066,,2016-01-01,year,,,,,For Profit,https://plankpad.com/,,,,"Plankpad helps with back pain, brings you in shape and you will get six pack abs in no time, doing plank workouts while playing a game on your smartphone.","Health Care, Sports",,,,,,,,,,,,,,,,,,,,,,,,,,,,,,,,,,,,,Private,,,,,,,,,,,
Invite Group,https://www.crunchbase.com/organization/invite-group,Active,,Hospitality,"Bonn, Nordrhein-Westfalen, Germany","Invite Group operating companies in the hotel, catering and leisure sectors with essential, central services.","2,279,511","European Union (EU), Europe, Middle East, and Africa (EMEA)",,,2016-01-01,year,,,,,For Profit,https://www.invite-group.com,,https://www.facebook.com/invitationgroup,https://www.linkedin.com/company/invite-group-gmbh,,Travel and Tourism,1,251-500,Jörg Haas,,,,,,,,,,,,,,,,,,,,,,,,,,,,,,,,,,Private,,,,,,,,,,,
ValleyHub,https://www.crunchbase.com/organization/valleyhub,Active,,"Real Estate, Rental Property","Maastricht, Limburg, The Netherlands",ValleyHub is a  Estate agent company.,"2,302,503","European Union (EU), Europe, Middle East, and Africa (EMEA)",6221 CH,Less than $1M,2016-01-01,day,,,,,For Profit,http://www.housinghub.nl,,https://www.facebook.com/housinghub.nl/,https://www.linkedin.com/company/valleyhub/,,Real Estate,,1-10,,,,,,,,,,,,,,,,,,,,,,,,,,,,,,,,,,,Private,,,,,,,,,,,
KUMA IT-Solutions,https://www.crunchbase.com/organization/kuma-it-solutions,Active,,"Email, Information Services, Information Technology, Technical Support, Web Development","Moers, Nordrhein-Westfalen, Germany",KUMA IT-Solutions offers information technology and services.,"2,316,299","European Union (EU), Europe, Middle East, and Africa (EMEA)",47445,Less than $1M,2016-01-01,year,,,,,For Profit,https://kuma-its.de,,,https://www.linkedin.com/company/kuma-it-solutions-gmbh/,"KUMA IT-Solutions GmbH is a system house. Their customers include companies from various industries and of all sizes. Their know-how includes advice and support in the fields of network technology, IT security, data security and data protection, as well as the digitization of companies. They are not willing or obliged to participate in dispute settlement procedures before a consumer arbitration board.","Information Technology, Internet Services, Messaging and Telecommunications, Other, Software",,1-10,,,,,,,,,,,,,,,,,,,,,,,,,,,,,,,,,,,Private,,,,,,,,,,,
PIF Isolatie,https://www.crunchbase.com/organization/pif-isolatie,Active,,"Building Material, Industrial, Manufacturing","Weert, Limburg, The Netherlands",PIF Isolatie manufactures multilayer insulation foil for efficient and easy installation.,"2,316,531","European Union (EU), Europe, Middle East, and Africa (EMEA)",6003 DK,,2016-01-01,year,,,,,For Profit,https://pifinsulation.com,,https://www.facebook.com/p/PIF-Isolatie-100083471915795,https://www.linkedin.com/company/reflex-insulation-group,"PIF Isolatie produces multilayer insulation foil designed for quick, clean, and safe installation. The insulation consists of multiple layers of heat-reflective aluminum separated by durable air cushions, enhancing energy efficiency in buildings. PIF Isolatie aims to simplify the insulation process, making it more accessible and effective for various applications.","Manufacturing, Real Estate",,11-50,,,,,,,,,,,,,,,,,,,,,,,,,,,,,,,,,,,Private,,,,,,,,,,,
